Keyword,Search Intent,Estimated Difficulty,Recommended Content Type,Stage,Notes
what is a GP,Informational,Low,Blog,Awareness,Great for people new to Australian healthcare
what does a general practitioner do,Informational,Low,Blog,Awareness,Appeals to new patients or people new to Perth
when should I see a doctor,Informational,Low,Blog,Awareness,Extremely broad appeal - very high volume
what is preventative healthcare,Informational,Low,Blog,Awareness,Directly matches WFP core service
how often should you have a health check,Informational,Low,Blog,Awareness,Ties to health checks service
what is a care plan,Informational,Low,Blog,Awareness,Medicare care plans - very common WFP service
what is a mental health care plan,Informational,Low,Blog,Awareness,Very high search volume across Australia
how do referrals work in Australia,Informational,Low,Blog,Awareness,Common question from new patients
what is a cervical screening test,Informational,Low,Blog,Awareness,Directly matches WFP womens health service
what is cryotherapy for skin,Informational,Low,Blog,Awareness,Matches WFP minor procedures service
what is INR monitoring,Informational,Low,Blog,Awareness,Specific WFP diagnostic service - low competition
what is a Holter monitor,Informational,Low,Blog,Awareness,Matches 24 hour Holter monitoring service
what is a pulmonary function test,Informational,Low,Blog,Awareness,Matches WFP diagnostic offering
how does telehealth work in Australia,Informational,Low,Blog,Awareness,WFP offers telehealth - growing search term
what vaccines do adults need in Australia,Informational,Low,Blog,Awareness,Ties to immunisations service
do I need a yellow fever vaccine for travel,Informational,Low,Blog,Awareness,Directly matches WFP yellow fever service
what is travel medicine,Informational,Low,Blog,Awareness,Matches WFP travel medicine service
what is family planning,Informational,Low,Blog,Awareness,Matches WFP family planning including IUD and Implanon
what is an IUD,Informational,Low,Blog,Awareness,High search volume - family planning service
what is Implanon,Informational,Low,Blog,Awareness,Specific contraceptive WFP inserts - very low competition
how to choose a GP in Perth,Informational,Low,Blog,Consideration,High intent - people actively looking for a doctor
how to get a mental health care plan in WA,Informational,Low,Blog,Consideration,State specific - strong local relevance
how to get a repeat prescription in Perth,Informational,Low,Blog,Consideration,Directly matches WFP script request service
what to expect at a skin check,Informational,Low,Blog,Consideration,Matches WFP skin checks service
how to prepare for a health check,Informational,Low,Blog,Consideration,Matches WFP health checks service
what is bulk billing and how does it work,Informational,Low,Blog,Consideration,Extremely high search volume in Australia
how to book a telehealth appointment in Perth,Informational,Low,Blog,Consideration,Matches WFP telehealth offering
what happens at a sports medicine appointment,Informational,Low,Blog,Consideration,Matches WFP sports medicine service
how long does a GP appointment take,Informational,Low,Blog,Consideration,Common patient question before booking
can a GP do minor surgery,Informational,Low,Blog,Consideration,Matches WFP minor surgery service
what is an ECG test,Informational,Low,Blog,Consideration,Matches WFP ECG testing service
how to get a WorkCover certificate in WA,Informational,Low,Blog,Consideration,Matches WFP WorkCover service
what is QPA accreditation for GP clinics,Informational,Low,Blog,Consideration,WFP is QPA accredited - strong trust signal content
how to get a referral to a specialist in Australia,Informational,Low,Blog,Consideration,Very common patient question
what is the Medicare Benefits Schedule,Informational,Low,Blog,Consideration,Foundational Australian healthcare education content
how does the Australian healthcare system work,Informational,Low,Blog,Awareness,Great for people new to Perth from overseas
what is a health assessment for over 75s,Informational,Low,Blog,Awareness,Matches WFP aged care and health checks
what is a chronic disease management plan,Informational,Low,Blog,Awareness,Matches WFP disease management service
how does wound care work at a GP clinic,Informational,Low,Blog,Awareness,Matches WFP wound care service
what is a pathology collection centre,Informational,Low,Blog,Awareness,WFP has onsite pathology - key differentiator
how to read your blood test results,Informational,Low,Blog,Awareness,Adjacent - ties to pathology collection on site
what does a GP check in a full blood count,Informational,Low,Blog,Awareness,Adjacent - pathology education content
how to lower cholesterol naturally,Informational,Low,Blog,Adjacent,Nutritional advice service - very high volume
what foods are good for heart health,Informational,Low,Blog,Adjacent,Nutritional advice - broad appeal
how to manage high blood pressure without medication,Informational,Low,Blog,Adjacent,Disease management - very high search volume
what is the best diet for diabetes management,Informational,Low,Blog,Adjacent,Chronic disease management adjacent topic
how to improve sleep naturally,Informational,Low,Blog,Adjacent,Very high volume - mental health adjacent
signs of burnout and what to do,Informational,Low,Blog,Adjacent,Mental health adjacent - very relatable in Perth
how to manage anxiety without medication,Informational,Low,Blog,Adjacent,Mental health care plan gateway content
how to talk to your doctor about mental health,Informational,Low,Blog,Adjacent,Reduces barrier to booking mental health appointment
how much exercise should adults do per week,Informational,Low,Blog,Adjacent,Sports medicine and preventative health adjacent
how to prevent running injuries,Informational,Low,Blog,Adjacent,Sports medicine adjacent - popular in Perth
how to recover from a sports injury faster,Informational,Low,Blog,Adjacent,Sports medicine service gateway content
when should a sports injury see a doctor,Informational,Low,Blog,Adjacent,Sports medicine - clear gateway to booking
how to protect your skin from the sun in Australia,Informational,Low,Blog,Adjacent,Skin check gateway - massive in WA
what SPF sunscreen should I use in Perth,Informational,Low,Blog,Adjacent,Adjacent to skin checks - WA specific very high volume
skin cancer rates in Western Australia,Informational,Low,Blog,Adjacent,WA has highest skin cancer rate - very relevant
how to check your own skin for cancer,Informational,Low,Blog,Adjacent,Skin check gateway content - very high volume
what does melanoma look like,Informational,Low,Blog,Adjacent,Skin check gateway - very high search volume
warning signs of skin cancer in Australia,Informational,Low,Blog,Adjacent,Skin check gateway - WA extremely relevant
healthy travel tips for long haul flights,Informational,Low,Blog,Adjacent,Travel medicine adjacent - Perth is remote so huge search
how to avoid getting sick while travelling,Informational,Low,Blog,Adjacent,Travel medicine gateway content
food safety tips when travelling overseas,Informational,Low,Blog,Adjacent,Travel medicine adjacent topic
what to pack in a travel health kit,Informational,Low,Blog,Adjacent,Travel medicine adjacent - practical content
how to manage a chronic condition at work,Informational,Low,Blog,Adjacent,WorkCover and chronic disease management adjacent
what are my rights if injured at work in WA,Informational,Low,Blog,Adjacent,WorkCover adjacent - WA specific legal info
how to return to work after illness or injury,Informational,Low,Blog,Adjacent,WorkCover adjacent - practical recovery content
best ways to boost your immune system,Informational,Low,Blog,Adjacent,Immunisations and preventative health adjacent
how to prepare for flu season in Australia,Informational,Low,Blog,Adjacent,Immunisations adjacent - seasonal search spike
what is the difference between a cold and the flu,Informational,Low,Blog,Adjacent,Very high volume - seasonal content
how to manage hay fever in Perth,Informational,Low,Blog,Adjacent,Very Perth specific - seasonal allergy content
womens health checks what to expect,Informational,Low,Blog,Adjacent,Cervical screening and womens health adjacent
what age should women start cervical screening,Informational,Low,Blog,Adjacent,Directly supports WFP cervical screening service
mens health checks what to include,Informational,Low,Blog,Adjacent,Preventative health adjacent - mens health gap in Perth
how to talk to your GP about erectile dysfunction,Informational,Low,Blog,Adjacent,Mens health adjacent - high search low competition
heart health checks for men over 45,Informational,Low,Blog,Adjacent,Preventative health and ECG testing adjacent
how to manage stress during pregnancy,Informational,Low,Blog,Adjacent,Antenatal and womens health adjacent
what to expect at your first antenatal appointment,Informational,Low,Blog,Adjacent,Antenatal care mentioned in WFP longer appointments
healthy eating tips for busy families,Informational,Low,Blog,Adjacent,Nutritional advice adjacent - very broad appeal Perth families
how to get kids to eat healthier,Informational,Low,Blog,Adjacent,Family medicine adjacent - very high volume
childhood vaccinations schedule Australia,Informational,Low,Blog,Adjacent,Immunisations adjacent - very high search volume
when should children see a GP,Informational,Low,Blog,Adjacent,Family medicine gateway content
how to manage your childs asthma,Informational,Low,Blog,Adjacent,Disease management adjacent - paediatrics
signs your child needs to see a doctor urgently,Informational,Low,Blog,Adjacent,Family medicine - very high parental search volume
how to help elderly parents manage medications,Informational,Low,Blog,Adjacent,Aged care adjacent - growing Perth demographic
what health checks should over 65s have,Informational,Low,Blog,Adjacent,Aged care and health checks adjacent
signs of dementia what to watch for,Informational,Low,Blog,Adjacent,Aged care adjacent - high search volume
how to support a family member with chronic illness,Informational,Low,Blog,Adjacent,Disease management adjacent - carer audience
what is palliative care and when is it needed,Informational,Low,Blog,Adjacent,Aged care adjacent - sensitive but high search volume
